{
  "schema_version": "die.manifest-signer-key.v1",
  "tenant_id": "tenant-acme",
  "key_id": "tenant-acme/bootstrap/2026-08",
  "algorithm": "ES256",
  "public_jwk": {
    "kty": "EC",
    "crv": "P-256",
    "x": "AAAAAAAAAAAAAAAAAAAAAAAAAAAAAAAAAAAAAAAAAAA",
    "y": "BBBBBBBBBBBBBBBBBBBBBBBBBBBBBBBBBBBBBBBBBBB"
  },
  "fingerprint": "sha256:bbbbbbbbbbbbbbbbbbbbbbbbbbbbbbbbbbbbbbbbbbbbbbbbbbbbbbbbbbbbbbbb",
  "state": "active",
  "manifest_kind": "tenant_bootstrap",
  "environment": "production",
  "not_before": "2026-08-01T00:00:00Z",
  "not_after": "2026-11-01T00:00:00Z",
  "revision": 1
}
